id,name,description,job_restriction,def_bonus,buy_price,sell_price,floor_min,floor_max
401,낡은 가죽 갑옷,기본 방어구. 최소한의 보호만 제공한다.,none,2,0,5,1,2
402,강철 흉갑,표준 규격의 흉갑. 든든한 방어력을 제공한다.,Warrior,7,80,40,1,4
403,중갑옷,두꺼운 철판으로 만든 갑옷. 둔하지만 견고하다.,Warrior,13,150,75,3,6
404,수호자의 판금갑옷,전설적인 기사의 갑옷. 빛을 반사하듯 빛난다.,Warrior,20,280,140,6,10
405,마법사 로브,마력 흐름을 방해하지 않도록 설계된 로브.,Mage,3,0,5,1,2
406,마력 강화 로브,마력이 직조된 로브. 방어와 마법 효율을 동시에 챙긴다.,Mage,6,80,40,1,4
407,현자의 망토,지혜로운 마법사가 걸쳤던 망토. 신비로운 방어력을 지닌다.,Mage,11,150,75,3,6
408,대마법사의 예복,최고위 마법사의 예복. 마력이 겹겹이 쌓여 있다.,Mage,17,280,140,6,10
